<?xml version = "1.0" encoding = "UTF-8"?>
<!DOCTYPE inventario SYSTEM "inventario2.dtd">
<inventario>
    <objeto codigo="MM28089">
      <mesa>
        <tipo>Oficina</tipo>
        <localizacion>B09</localizacion>
      </mesa>
    </objeto>
    <objeto>
      <ordenador>
        <procesador fabricante="Intel">i3</procesador>
        <memoria unidad="GB">2</memoria>
        <discoduro>520</discoduro>
      </ordenador>
    </objeto>
</inventario>